{
  "caseId": "C26m",
  "title": "FB with a timer called inside an IF of its caller",
  "kind": "analyzer",
  "basedOn": null,
  "tiaVersion": "V21",
  "plc": "PLC_Main",
  "cpu": "OrderNumber:6ES7 516-3FP03-0AB0/V4.1",
  "objects": [
    {
      "name": "FB_AnaTimerCaller",
      "type": "FB",
      "number": 19,
      "language": "SCL",
      "unit": null,
      "namespace": null,
      "group": "Analyzer",
      "iecCheck": false,
      "failsafe": false,
      "consistent": true
    },
    {
      "name": "IDB_AnaTimerCaller",
      "type": "InstanceDB",
      "number": 15,
      "language": "DB",
      "unit": null,
      "namespace": null,
      "group": "Analyzer",
      "iecCheck": null,
      "failsafe": false,
      "consistent": true
    },
    {
      "name": "FB_AnaTimerInner",
      "type": "FB",
      "number": 17,
      "language": "SCL",
      "unit": null,
      "namespace": null,
      "group": "Analyzer",
      "iecCheck": false,
      "failsafe": false,
      "consistent": true
    }
  ],
  "exports": {
    "documents": [
      "documents/FB_AnaTimerCaller.s7dcl",
      "documents/FB_AnaTimerCaller.s7res",
      "documents/IDB_AnaTimerCaller.s7dcl",
      "documents/FB_AnaTimerInner.s7dcl",
      "documents/FB_AnaTimerInner.s7res"
    ],
    "source": [
      "source/FB_AnaTimerCaller.scl",
      "source/IDB_AnaTimerCaller.db",
      "source/FB_AnaTimerInner.scl"
    ],
    "simaticml": [
      "simaticml/FB_AnaTimerCaller.xml",
      "simaticml/IDB_AnaTimerCaller.xml",
      "simaticml/FB_AnaTimerInner.xml"
    ],
    "vci": [
      "vci/SimaticSD/FB_AnaTimerCaller.s7dcl",
      "vci/SimaticSD/FB_AnaTimerCaller.s7res",
      "vci/SimaticML/FB_AnaTimerCaller.xml",
      "vci/SimaticSD/IDB_AnaTimerCaller.s7dcl",
      "vci/SimaticML/IDB_AnaTimerCaller.xml",
      "vci/SimaticSD/FB_AnaTimerInner.s7dcl",
      "vci/SimaticSD/FB_AnaTimerInner.s7res",
      "vci/SimaticML/FB_AnaTimerInner.xml"
    ],
    "refused": {}
  },
  "compile": {
    "state": "Success",
    "errors": 0,
    "warnings": 0,
    "messages": [
      {
        "severity": "Success",
        "path": "PLC_Main > Program blocks > Analyzer > FB_AnaTimerCaller (FB19)",
        "block": "FB_AnaTimerCaller",
        "line": null,
        "network": null,
        "description": "Block was successfully compiled."
      },
      {
        "severity": "Success",
        "path": "PLC_Main > Program blocks > Analyzer > FB_AnaTimerInner (FB17)",
        "block": "FB_AnaTimerInner",
        "line": null,
        "network": null,
        "description": "Block was successfully compiled."
      }
    ],
    "sources": [
      "FB_AnaTimerCaller: compile-clean-PLC_Main.json batches[s2-b12-C26-C12.json] compiles[1]",
      "FB_AnaTimerInner: compile-clean-PLC_Main.json batches[s2-b12-C26-C12.json] compiles[0]"
    ]
  },
  "intendedError": null,
  "analyzerExpect": [
    {
      "rule": "timer-fb-called-conditionally",
      "block": "FB_AnaTimerCaller",
      "line": 3
    }
  ],
  "notes": ""
}
