{
  "caseId": "C25",
  "title": "S7-1200 conveyor",
  "kind": "clean",
  "basedOn": null,
  "tiaVersion": "V21",
  "plc": "PLC_1200",
  "cpu": "OrderNumber:6ES7 214-1AG40-0XB0/V4.7",
  "objects": [
    {
      "name": "FB_Conveyor1200",
      "type": "FB",
      "number": 1,
      "language": "SCL",
      "unit": null,
      "namespace": null,
      "group": "S7-1200",
      "iecCheck": false,
      "failsafe": false,
      "consistent": true
    },
    {
      "name": "IDB_Conveyor1200",
      "type": "InstanceDB",
      "number": 1,
      "language": "DB",
      "unit": null,
      "namespace": null,
      "group": "S7-1200",
      "iecCheck": null,
      "failsafe": false,
      "consistent": true
    },
    {
      "name": "OB_Main",
      "type": "OB",
      "number": 1,
      "language": "SCL",
      "unit": null,
      "namespace": null,
      "group": "S7-1200",
      "iecCheck": false,
      "failsafe": false,
      "consistent": true
    },
    {
      "name": "Tags_1200",
      "type": "TagTable",
      "language": null,
      "unit": null,
      "group": null,
      "iecCheck": null,
      "failsafe": false
    }
  ],
  "exports": {
    "documents": [
      "documents/FB_Conveyor1200.s7dcl",
      "documents/FB_Conveyor1200.s7res",
      "documents/IDB_Conveyor1200.s7dcl",
      "documents/OB_Main.s7dcl"
    ],
    "source": [
      "source/FB_Conveyor1200.scl",
      "source/IDB_Conveyor1200.db",
      "source/OB_Main.scl"
    ],
    "simaticml": [
      "simaticml/FB_Conveyor1200.xml",
      "simaticml/IDB_Conveyor1200.xml",
      "simaticml/OB_Main.xml",
      "simaticml/OB_Main.readonly.xml"
    ],
    "vci": [
      "vci/SimaticSD/FB_Conveyor1200.s7dcl",
      "vci/SimaticSD/FB_Conveyor1200.s7res",
      "vci/SimaticML/FB_Conveyor1200.xml",
      "vci/SimaticSD/IDB_Conveyor1200.s7dcl",
      "vci/SimaticML/IDB_Conveyor1200.xml",
      "vci/SimaticSD/OB_Main.s7dcl",
      "vci/SimaticML/OB_Main.xml",
      "tagtables/Tags_1200.xml"
    ],
    "tagtables": [
      "tagtables/Tags_1200.xml",
      "tagtables/Tags_1200.json"
    ],
    "refused": {
      "vci_SimaticSD": {
        "Tags_1200": "Tags_IO supports the formats SimaticML. (vci_sync INVALID_ARGUMENT for Tags_IO; tag tables have no SimaticSD format)"
      }
    }
  },
  "compile": {
    "state": "Success",
    "errors": 0,
    "warnings": 0,
    "messages": [
      {
        "severity": "Success",
        "path": "PLC_1200 > Program blocks > S7-1200 > FB_Conveyor1200 (FB1)",
        "block": "FB_Conveyor1200",
        "line": null,
        "network": null,
        "description": "Block was successfully compiled."
      },
      {
        "severity": "Success",
        "path": "PLC_1200 > Program blocks > S7-1200 > OB_Main (OB1)",
        "block": "OB_Main",
        "line": null,
        "network": null,
        "description": "Block was successfully compiled."
      }
    ],
    "sources": [
      "FB_Conveyor1200: compile-clean-PLC_1200.json batches[s2-b11-C25-PLC_1200.json]",
      "OB_Main: compile-clean-PLC_1200.json batches[s2-b11-C25-PLC_1200.json]"
    ]
  },
  "intendedError": null,
  "analyzerExpect": [],
  "notes": "S7-1200 detail: no 64-bit data types on S7-1200 (TON_TIME / Time / DInt, never LTime/LInt); onboard AI 0..27648 scaled with NORM_X/SCALE_X."
}
