{
  "caseId": "C31",
  "title": "Integer literal 1 assigned to a Bool",
  "kind": "clean",
  "basedOn": null,
  "tiaVersion": "V21",
  "plc": "PLC_Main",
  "cpu": "OrderNumber:6ES7 516-3FP03-0AB0/V4.1",
  "objects": [
    {
      "name": "FC_V_E09",
      "type": "FC",
      "number": 33,
      "language": "SCL",
      "unit": null,
      "namespace": null,
      "group": "Verify",
      "iecCheck": false,
      "failsafe": false,
      "consistent": true
    }
  ],
  "exports": {
    "documents": [
      "documents/FC_V_E09.s7dcl"
    ],
    "source": [
      "source/FC_V_E09.scl"
    ],
    "refused": {}
  },
  "compile": {
    "state": "Success",
    "errors": 0,
    "warnings": 0,
    "messages": [
      {
        "severity": "Success",
        "path": "PLC_Main > Program blocks > Verify > FC_V_E09 (FC33)",
        "block": "FC_V_E09",
        "line": null,
        "network": null,
        "description": "Block was successfully compiled."
      }
    ],
    "sources": [
      "verification compile of PLC_Main, 2026-10-24 (corpus project not saved)"
    ]
  },
  "intendedError": "TIA accepts #b := 1 without a message",
  "analyzerExpect": [],
  "notes": "Added 2026-10-24 by PLC Studio to verify checker rules against TIA V21; imported with plc_import_documents into group Verify, compiled, exported with plc_export_block (documents, tool text without BOM). The corpus project was not saved. Session 7 (2026-10-24): the external source was added; the block was imported again into the unsaved corpus project from these SIMATIC SD documents, compiled with the same result, and written by PlcExternalSourceSystemGroup.GenerateSource (option None), copied byte for byte."
}
