{
  "caseId": "C34",
  "title": "Real literal assigned to an Int",
  "kind": "clean",
  "basedOn": null,
  "tiaVersion": "V21",
  "plc": "PLC_Main",
  "cpu": "OrderNumber:6ES7 516-3FP03-0AB0/V4.1",
  "objects": [
    {
      "name": "FC_V_E16",
      "type": "FC",
      "number": 39,
      "language": "SCL",
      "unit": null,
      "namespace": null,
      "group": "Verify",
      "iecCheck": false,
      "failsafe": false,
      "consistent": true
    }
  ],
  "exports": {
    "documents": [
      "documents/FC_V_E16.s7dcl"
    ],
    "refused": {}
  },
  "compile": {
    "state": "Warning",
    "errors": 0,
    "warnings": 1,
    "messages": [
      {
        "severity": "Warning",
        "path": "PLC_Main > Program blocks > Verify > FC_V_E16 (FC39) > 2",
        "block": "FC_V_E16",
        "line": 2,
        "network": null,
        "description": "The sign or the accuracy of the value may be lost."
      },
      {
        "severity": "Success",
        "path": "PLC_Main > Program blocks > Verify > FC_V_E16 (FC39)",
        "block": "FC_V_E16",
        "line": null,
        "network": null,
        "description": "Block was successfully compiled."
      }
    ],
    "sources": [
      "verification compile of PLC_Main, 2026-10-24 (corpus project not saved)"
    ]
  },
  "intendedError": "TIA only warns",
  "analyzerExpect": [],
  "notes": "Added 2026-10-24 by PLC Studio to verify checker rules against TIA V21; imported with plc_import_documents into group Verify, compiled, exported with plc_export_block (documents, tool text without BOM). The corpus project was not saved."
}
