{
  "caseId": "C19",
  "title": "FBD logic gates, SR/RS and edge",
  "kind": "clean",
  "basedOn": null,
  "tiaVersion": "V21",
  "plc": "PLC_Main",
  "cpu": "OrderNumber:6ES7 516-3FP03-0AB0/V4.1",
  "objects": [
    {
      "name": "FC_FbdLogic",
      "type": "FC",
      "number": 8,
      "language": "FBD",
      "unit": null,
      "namespace": null,
      "group": "Fbd",
      "iecCheck": false,
      "failsafe": false,
      "consistent": true
    }
  ],
  "exports": {
    "documents": [
      "documents/FC_FbdLogic.s7dcl"
    ],
    "simaticml": [
      "simaticml/FC_FbdLogic.xml"
    ],
    "vci": [
      "vci/SimaticSD/FC_FbdLogic.s7dcl",
      "vci/SimaticML/FC_FbdLogic.xml"
    ],
    "refused": {
      "source": {
        "FC_FbdLogic": "Error when calling method 'GenerateSource' of type 'Siemens.Engineering.SW.ExternalSources.PlcExternalSourceSystemGroup'. Select a block that only includes SCL or STL and is not know-how protected. External source files can only be generated when all selected code blocks have been created in SCL or STL. The language of all blocks is shown in the overview of the project tree in the \"Details\" tab."
      }
    }
  },
  "compile": {
    "state": "Success",
    "errors": 0,
    "warnings": 0,
    "messages": [
      {
        "severity": "Success",
        "path": "PLC_Main > Program blocks > Fbd > FC_FbdLogic (FC8)",
        "block": "FC_FbdLogic",
        "line": null,
        "network": null,
        "description": "Block was successfully compiled."
      }
    ],
    "sources": [
      "FC_FbdLogic: compile-clean-PLC_Main.json batches[s2-b08-C16-C21.json] compiles[1]"
    ]
  },
  "intendedError": null,
  "analyzerExpect": [],
  "notes": ""
}
