{
  "caseId": "B12",
  "title": "Two Static members whose names differ only by case",
  "kind": "broken",
  "basedOn": "C05",
  "tiaVersion": "V21",
  "plc": "PLC_Main",
  "cpu": "OrderNumber:6ES7 516-3FP03-0AB0/V4.1",
  "objects": [
    {
      "name": "FB_SclSections_B12",
      "type": "FB",
      "number": 26,
      "language": "SCL",
      "unit": null,
      "namespace": null,
      "group": "Broken",
      "iecCheck": false,
      "failsafe": false,
      "consistent": true
    }
  ],
  "exports": {
    "documents": [
      "documents/FB_SclSections_B12.s7dcl",
      "documents/FB_SclSections_B12.s7res"
    ],
    "source": [
      "source/FB_SclSections_B12.scl"
    ],
    "simaticml": [
      "simaticml/FB_SclSections_B12.xml"
    ],
    "vci": [
      "vci/SimaticSD/FB_SclSections_B12.s7dcl",
      "vci/SimaticSD/FB_SclSections_B12.s7res",
      "vci/SimaticML/FB_SclSections_B12.xml"
    ],
    "refused": {}
  },
  "compile": {
    "state": "importRefused",
    "errors": 0,
    "warnings": 0,
    "importRefusal": {
      "tool": "plc_import_documents",
      "format": "documents (.s7dcl with \"State\" and \"state\")",
      "message": "Import failed because of duplicate variable 'State' in declaration section. Importing from file '...\\FB_SclSections_B12.s7dcl'... 1 errors, 0 warnings : Import of block(s) failed. please check the s7dcl file."
    },
    "messages": [
      {
        "severity": "Success",
        "path": "PLC_Main > Program blocks > Broken > FB_SclSections_B12 (FB26)",
        "block": "FB_SclSections_B12",
        "line": null,
        "network": null,
        "description": "Block was successfully compiled."
      }
    ],
    "messagesOfGeneratedVariant": "Success",
    "sources": [
      "FB_SclSections_B12: compile-broken-PLC_Main.json first"
    ]
  },
  "intendedError": "two Static members \"State\" and \"state\" (names differ only by case)",
  "analyzerExpect": [],
  "notes": "TIA refused the documents import (importRefused). The block in the project was generated from SCL source, where TIA silently renamed the second member to \"state_1\"; that variant compiles. Exports are of that variant. Manual step: try the duplicate in the editor."
}
